{
  "attestation_correspondence_scope": "REQUIRES_ORIGINAL_INPUT",
  "attestation_integrity_scope": "SELF_CONSISTENCY_ONLY",
  "authority_exclusions": {
    "fraud_determination_authority": "NONE",
    "legal_authority": "NONE",
    "money_movement": "NONE",
    "payment_authority": "NONE",
    "policy_interpretation_authority": "NONE",
    "settlement_authority": "NONE"
  },
  "authority_profile_id": "CLAIM-AUTHORITY-EVIDENCE-1",
  "canonicalization_id": "SLANG-CANONICAL-JSON-1-D02",
  "contract_id": "slang_claims_contract_sha256:dcc9fe86df0ded6930fe7c4116ba0f22e43220605d6a0bfd96b75c44f5f19d9a",
  "core_version": "SLANG-CORE-1-D05",
  "forbidden_field_matching": "ASCII_CAMEL_SEPARATOR_AND_COMPACT_SIGNATURES",
  "forbidden_value_commitment": "REDACTED_BEFORE_SUBMISSION_ID",
  "identity_domain_id": "slang_claims_identity_domain_sha256:849c01acebc72403093ffa5e6878136d06a33cbb96ae2ab82827ec91e9cb999e",
  "library_entry_validation": "PORTABLE_JSON_AND_RESOURCE_LIMITS_BEFORE_DOMAIN_SCAN",
  "payable_formula": "min(max(min(claim_amount_minor, assessed_loss_minor) - deductible_minor, 0), remaining_limit_minor)",
  "profile_id": "SLANG-CLAIMS-PROFILE-1-D03",
  "python_compatibility": "PYTHON_3_9_COMPATIBLE_SYNTAX_USE_SUPPORTED_CPYTHON_RUNTIME",
  "quantum_profile_id": "CLAIM-QUANTUM-NET-AFTER-DEDUCTIBLE-CAP-1",
  "reason_code_emission": "REGISTRY_CLOSED_BY_CONSTRUCTION_AND_RESULT_FIREWALL",
  "reason_code_registry": [
    "BOOLEAN_REQUIRED",
    "CLAIM_PAYABILITY_ADMITTED",
    "CONTEXT_OBJECT_REQUIRED",
    "CONTROL_BLOCKS_PAYABILITY",
    "COVERAGE_NOT_ADMITTED",
    "DECLARED_CONTEXT_ID_MISMATCH",
    "DECLARED_EVIDENCE_SET_ID_MISMATCH",
    "DUPLICATE_AUTHORITY_EVIDENCE",
    "DUPLICATE_EVIDENCE_ID",
    "DUPLICATE_IDENTIFIER",
    "EMPTY_IDENTIFIER_LIST",
    "EVALUATION_NOT_AUTHORIZED",
    "EVIDENCE_BINDING_MISMATCH",
    "EVIDENCE_LIST_REQUIRED",
    "EVIDENCE_OBJECT_REQUIRED",
    "EVIDENCE_RESULT_DISAGREEMENT",
    "EXCLUSION_BLOCKS_PAYABILITY",
    "FLOAT_NOT_SUPPORTED",
    "FORBIDDEN_FIELD_PRESENT",
    "IDENTIFIER_LIST_REQUIRED",
    "INTEGER_OUT_OF_PORTABLE_RANGE",
    "INTEGER_OUT_OF_RANGE",
    "INVALID_CURRENCY_UNIT",
    "INVALID_EVIDENCE_COMMITMENT",
    "INVALID_IDENTIFIER",
    "JSON_DEPTH_LIMIT",
    "JSON_NODE_LIMIT",
    "LIST_TOO_LONG",
    "LONE_SURROGATE",
    "MISSING_EXPECTED_AUTHORITY",
    "MISSING_REQUIRED_FIELD",
    "MULTI_AUTHORITY_REQUIRES_AT_LEAST_TWO_AUTHORITIES",
    "MULTI_AUTHORITY_REQUIRES_MULTIPLE_EVIDENCE_RECORDS",
    "NONNEGATIVE_INTEGER_REQUIRED",
    "NON_STRING_OBJECT_KEY",
    "NO_AMOUNT_ABOVE_DEDUCTIBLE",
    "NO_REMAINING_LIMIT",
    "OBJECT_KEY_TOO_LONG",
    "OCCURRENCE_NOT_ADMITTED",
    "OUTCOME_WITHHELD",
    "SINGLE_AUTHORITY_REQUIRES_EXACTLY_ONE_AUTHORITY",
    "SINGLE_AUTHORITY_REQUIRES_EXACTLY_ONE_EVIDENCE_RECORD",
    "STRING_TOO_LONG",
    "TOO_MANY_AUTHORITIES",
    "TOO_MANY_EVIDENCE_RECORDS",
    "TOP_LEVEL_OBJECT_REQUIRED",
    "UNEXPECTED_AUTHORITY",
    "UNKNOWN_FIELD",
    "UNSUPPORTED_CONTROL_RESULT",
    "UNSUPPORTED_COVERAGE_RESULT",
    "UNSUPPORTED_EVIDENCE_MODE",
    "UNSUPPORTED_EVIDENCE_SCHEMA",
    "UNSUPPORTED_EXCLUSION_RESULT",
    "UNSUPPORTED_INPUT_SCHEMA",
    "UNSUPPORTED_JSON_TYPE",
    "UNSUPPORTED_OCCURRENCE_RESULT",
    "UNSUPPORTED_PROFILE_ID",
    "UNSUPPORTED_RULESET_ID",
    "ZERO_PAYABLE_AMOUNT"
  ],
  "receipt_correspondence_scope": "REQUIRES_EXACT_RECONSTRUCTION_BUNDLE",
  "receipt_integrity_scope": "SELF_CONSISTENCY_AND_DECLARED_INVARIANTS_ONLY",
  "resource_limits": {
    "max_evidence_records": 8,
    "max_identifier_length": 128,
    "max_json_depth": 48,
    "max_json_input_bytes": 1048576,
    "max_json_nodes": 50000,
    "max_list_length": 256,
    "max_reason_codes": 64,
    "max_safe_integer": 9007199254740991,
    "max_string_length": 1024
  },
  "ruleset_id": "SLANG-CLAIMS-RULESET-1-D03",
  "schema": "SLANG-CLAIMS-CONTRACT-1",
  "schema_validation_scope": "PREFLIGHT_ONLY",
  "schemas": {
    "attestation": "SLANG-CLAIMS-ATTESTATION-1",
    "bundle": "SLANG-CLAIMS-BUNDLE-1",
    "input": "SLANG-CLAIMS-INPUT-1",
    "receipt": "SLANG-CLAIMS-RECEIPT-1",
    "result": "SLANG-CLAIMS-RESULT-1",
    "summary": "SLANG-CLAIMS-SUMMARY-1"
  },
  "state_precedence": [
    "FORBIDDEN",
    "CONFLICT",
    "UNSUPPORTED",
    "INCOMPLETE",
    "ABSTAIN",
    "RESOLVED"
  ],
  "supported_admission_states": [
    "ADMIT",
    "DENY",
    "WITHHOLD"
  ],
  "supported_evidence_modes": [
    "MULTI_AUTHORITY_EXACT_AGREEMENT",
    "SINGLE_AUTHORITY"
  ],
  "supported_outcomes": [
    "NONE",
    "NOT_PAYABLE",
    "PAYABLE"
  ],
  "supported_states": [
    "ABSTAIN",
    "CONFLICT",
    "FORBIDDEN",
    "INCOMPLETE",
    "RESOLVED",
    "UNSUPPORTED"
  ],
  "version": "0.2.1"
}
